Service Operation,baseCRBQName,Service Domain,Role Definition
Exchange Trading Position Management Plan,TradingPositionManagementPlan,Trading Book Oversight,Role for Exchange Trading Position Management Plan service operation
Grant Trading Position Management Plan,TradingPositionManagementPlan,Trading Book Oversight,Role for Grant Trading Position Management Plan service operation
Notify Trading Position Management Plan,TradingPositionManagementPlan,Trading Book Oversight,Role for Notify Trading Position Management Plan service operation
Request Trading Position Management Plan,TradingPositionManagementPlan,Trading Book Oversight,Role for Request Trading Position Management Plan service operation
Retrieve Trading Position Management Plan,TradingPositionManagementPlan,Trading Book Oversight,Role for Retrieve Trading Position Management Plan service operation
Update Trading Position Management Plan,TradingPositionManagementPlan,Trading Book Oversight,Role for Update Trading Position Management Plan service operation
Exchange Trading Book Analysis and Reporting Duty,TradingBookAnalysisandReporting,Trading Book Oversight,Role for Exchange Trading Book Analysis and Reporting Duty service operation
Exchange Trading Book Risk Mitigation Duty,TradingBookRiskMitigation,Trading Book Oversight,Role for Exchange Trading Book Risk Mitigation Duty service operation
Grant Trading Book Analysis and Reporting Duty,TradingBookAnalysisandReporting,Trading Book Oversight,Role for Grant Trading Book Analysis and Reporting Duty service operation
Grant Trading Book Risk Mitigation Duty,TradingBookRiskMitigation,Trading Book Oversight,Role for Grant Trading Book Risk Mitigation Duty service operation
Notify Trading Book Analysis and Reporting Duty,TradingBookAnalysisandReporting,Trading Book Oversight,Role for Notify Trading Book Analysis and Reporting Duty service operation
Notify Trading Book Risk Mitigation Duty,TradingBookRiskMitigation,Trading Book Oversight,Role for Notify Trading Book Risk Mitigation Duty service operation
Request Trading Book Analysis and Reporting Duty,TradingBookAnalysisandReporting,Trading Book Oversight,Role for Request Trading Book Analysis and Reporting Duty service operation
Request Trading Book Risk Mitigation Duty,TradingBookRiskMitigation,Trading Book Oversight,Role for Request Trading Book Risk Mitigation Duty service operation
Retrieve Trading Book Analysis and Reporting Duty,TradingBookAnalysisandReporting,Trading Book Oversight,Role for Retrieve Trading Book Analysis and Reporting Duty service operation
Retrieve Trading Book Risk Mitigation Duty,TradingBookRiskMitigation,Trading Book Oversight,Role for Retrieve Trading Book Risk Mitigation Duty service operation
Update Trading Book Analysis and Reporting Duty,TradingBookAnalysisandReporting,Trading Book Oversight,Role for Update Trading Book Analysis and Reporting Duty service operation
Update Trading Book Risk Mitigation Duty,TradingBookRiskMitigation,Trading Book Oversight,Role for Update Trading Book Risk Mitigation Duty service operation
CoCR Control the processing of Mortgage Loan Arrangement,MortgageLoanFacility,Mortgage Loan,Role for Control the processing of Mortgage Loan Arrangement service operation
"EcCR Accept, verify, etc. aspects of Mortgage Loan Arrangement processing",MortgageLoanFacility,Mortgage Loan,"Role for Accept, verify, etc. aspects of Mortgage Loan Arrangement processing service operation"
ExCR Execute an available automated action for Mortgage Loan Arrangement,MortgageLoanFacility,Mortgage Loan,Role for Execute an available automated action for Mortgage Loan Arrangement service operation
InCR Instantiate a new Mortgage Loan Facility,MortgageLoanFacility,Mortgage Loan,Role for Instantiate a new Mortgage Loan Facility service operation
ReCR Retrieve details about any aspect of Mortgage Loan Arrangement,MortgageLoanFacility,Mortgage Loan,Role for Retrieve details about any aspect of Mortgage Loan Arrangement service operation
RqCR Request manual intervention or a decision with respect to Mortgage Loan Arrangement,MortgageLoanFacility,Mortgage Loan,Role for Request manual intervention or a decision with respect to Mortgage Loan Arrangement service operation
UpCR Update details relating to Mortgage Loan Arrangement,MortgageLoanFacility,Mortgage Loan,Role for Update details relating to Mortgage Loan Arrangement service operation
"EcBQ Accept, verify, etc. aspects of Billing processing",Billing,Mortgage Loan,"Role for Accept, verify, etc. aspects of Billing processing service operation"
"EcBQ Accept, verify, etc. aspects of Fees processing",Fees,Mortgage Loan,"Role for Accept, verify, etc. aspects of Fees processing service operation"
"EcBQ Accept, verify, etc. aspects of Lien processing",Lien,Mortgage Loan,"Role for Accept, verify, etc. aspects of Lien processing service operation"
"EcBQ Accept, verify, etc. aspects of Payments processing",Payments,Mortgage Loan,"Role for Accept, verify, etc. aspects of Payments processing service operation"
"EcBQ Accept, verify, etc. aspects of Sweep processing",Sweep,Mortgage Loan,"Role for Accept, verify, etc. aspects of Sweep processing service operation"
InBQ Instantiate a new Billing,Billing,Mortgage Loan,Role for Instantiate a new Billing service operation
InBQ Instantiate a new Collateral,Collateral,Mortgage Loan,Role for Instantiate a new Collateral service operation
InBQ Instantiate a new Deposits,Deposits,Mortgage Loan,Role for Instantiate a new Deposits service operation
InBQ Instantiate a new Fees,Fees,Mortgage Loan,Role for Instantiate a new Fees service operation
InBQ Instantiate a new Financial Instrument,FinancialInstrument,Mortgage Loan,Role for Instantiate a new Financial Instrument service operation
Initiate Provision of Issued Device,IssuedDevice,Mortgage Loan,Role for Initiate Provision of Issued Device service operation
InBQ Instantiate a new Lien,Lien,Mortgage Loan,Role for Instantiate a new Lien service operation
InBQ Instantiate a new Payments,Payments,Mortgage Loan,Role for Instantiate a new Payments service operation
InBQ Instantiate a new Sweep,Sweep,Mortgage Loan,Role for Instantiate a new Sweep service operation
InBQ Instantiate a new Withdrawals,Withdrawals,Mortgage Loan,Role for Instantiate a new Withdrawals service operation
ReBQ Retrieve details about any aspect of Billing,Billing,Mortgage Loan,Role for Retrieve details about any aspect of Billing service operation
ReBQ Retrieve details about any aspect of Collateral,Collateral,Mortgage Loan,Role for Retrieve details about any aspect of Collateral service operation
ReBQ Retrieve details about any aspect of Deposits,Deposits,Mortgage Loan,Role for Retrieve details about any aspect of Deposits service operation
ReBQ Retrieve details about any aspect of Fees,Fees,Mortgage Loan,Role for Retrieve details about any aspect of Fees service operation
ReBQ Retrieve details about any aspect of Financial Accounting,FinancialAccounting,Mortgage Loan,Role for Retrieve details about any aspect of Financial Accounting service operation
ReBQ Retrieve details about any aspect of Financial Instrument,FinancialInstrument,Mortgage Loan,Role for Retrieve details about any aspect of Financial Instrument service operation
ReBQ Retrieve details about any aspect of Interest,Interest,Mortgage Loan,Role for Retrieve details about any aspect of Interest service operation
Retrieve Details about Issued Device,IssuedDevice,Mortgage Loan,Role for Retrieve Details about Issued Device service operation
ReBQ Retrieve details about any aspect of Lien,Lien,Mortgage Loan,Role for Retrieve details about any aspect of Lien service operation
ReBQ Retrieve details about any aspect of Payments,Payments,Mortgage Loan,Role for Retrieve details about any aspect of Payments service operation
ReBQ Retrieve details about any aspect of Sweep,Sweep,Mortgage Loan,Role for Retrieve details about any aspect of Sweep service operation
ReBQ Retrieve details about any aspect of Withdrawals,Withdrawals,Mortgage Loan,Role for Retrieve details about any aspect of Withdrawals service operation
RqBQ Request manual intervention or a decision with respect to Collateral,Collateral,Mortgage Loan,Role for Request manual intervention or a decision with respect to Collateral service operation
RqBQ Request manual intervention or a decision with respect to Fees,Fees,Mortgage Loan,Role for Request manual intervention or a decision with respect to Fees service operation
UpBQ Update details relating to Billing,Billing,Mortgage Loan,Role for Update details relating to Billing service operation
UpBQ Update details relating to Collateral,Collateral,Mortgage Loan,Role for Update details relating to Collateral service operation
UpBQ Update details relating to Deposits,Deposits,Mortgage Loan,Role for Update details relating to Deposits service operation
UpBQ Update details relating to Fees,Fees,Mortgage Loan,Role for Update details relating to Fees service operation
UpBQ Update details relating to Financial Accounting,FinancialAccounting,Mortgage Loan,Role for Update details relating to Financial Accounting service operation
UpBQ Update details relating to Financial Instrument,FinancialInstrument,Mortgage Loan,Role for Update details relating to Financial Instrument service operation
UpBQ Update details relating to Interest,Interest,Mortgage Loan,Role for Update details relating to Interest service operation
Update Details of Issued Device Allocated to This Account,IssuedDevice,Mortgage Loan,Role for Update Details of Issued Device Allocated to This Account service operation
UpBQ Update details relating to Lien,Lien,Mortgage Loan,Role for Update details relating to Lien service operation
UpBQ Update details relating to Payments,Payments,Mortgage Loan,Role for Update details relating to Payments service operation
UpBQ Update details relating to Sweep,Sweep,Mortgage Loan,Role for Update details relating to Sweep service operation
UpBQ Update details relating to Withdrawals,Withdrawals,Mortgage Loan,Role for Update details relating to Withdrawals service operation
Execute Authorization of Booking,BookingAuthorization,Mortgage Loan,Role for Execute Authorization of Booking service operation
CoCR Control the processing of Product Combination Facility,ProductCombinationFacility,Product Combination,Role for Control the processing of Product Combination Facility service operation
"EcCR Accept, verify, etc. aspects of Product Combination Facility processing",ProductCombinationFacility,Product Combination,"Role for Accept, verify, etc. aspects of Product Combination Facility processing service operation"
ExCR Execute an available automated action for Product Combination Facility,ProductCombinationFacility,Product Combination,Role for Execute an available automated action for Product Combination Facility service operation
InCR Instantiate a new Product Combination Facility,ProductCombinationFacility,Product Combination,Role for Instantiate a new Product Combination Facility service operation
ReCR Retrieve details about any aspect of Product Combination Facility,ProductCombinationFacility,Product Combination,Role for Retrieve details about any aspect of Product Combination Facility service operation
RqCR Request manual intervention or a decision with respect to Product Combination Facility,ProductCombinationFacility,Product Combination,Role for Request manual intervention or a decision with respect to Product Combination Facility service operation
UpCR Update details relating to Product Combination Facility,ProductCombinationFacility,Product Combination,Role for Update details relating to Product Combination Facility service operation
CoBQ Control the processing of Fulfillment,Fulfillment,Product Combination,Role for Control the processing of Fulfillment service operation
"EcBQ Accept, verify, etc. aspects of Fulfillment processing",Fulfillment,Product Combination,"Role for Accept, verify, etc. aspects of Fulfillment processing service operation"
"EcBQ Accept, verify, etc. aspects of Transfer Pricing processing",TransferPricing,Product Combination,"Role for Accept, verify, etc. aspects of Transfer Pricing processing service operation"
ExBQ Execute an available automated action for Fulfillment,Fulfillment,Product Combination,Role for Execute an available automated action for Fulfillment service operation
InBQ Instantiate a new Embedded Product Control,EmbeddedProductControl,Product Combination,Role for Instantiate a new Embedded Product Control service operation
InBQ Instantiate a new Fulfillment,Fulfillment,Product Combination,Role for Instantiate a new Fulfillment service operation
ReBQ Retrieve details about any aspect of Embedded Product Control,EmbeddedProductControl,Product Combination,Role for Retrieve details about any aspect of Embedded Product Control service operation
ReBQ Retrieve details about any aspect of Fulfillment,Fulfillment,Product Combination,Role for Retrieve details about any aspect of Fulfillment service operation
ReBQ Retrieve details about any aspect of Transfer Pricing,TransferPricing,Product Combination,Role for Retrieve details about any aspect of Transfer Pricing service operation
RqBQ Request manual intervention or a decision with respect to Fulfillment,Fulfillment,Product Combination,Role for Request manual intervention or a decision with respect to Fulfillment service operation
RqBQ Request manual intervention or a decision with respect to Transfer Pricing,TransferPricing,Product Combination,Role for Request manual intervention or a decision with respect to Transfer Pricing service operation
UpBQ Update details relating to Embedded Product Control,EmbeddedProductControl,Product Combination,Role for Update details relating to Embedded Product Control service operation
UpBQ Update details relating to Fulfillment,Fulfillment,Product Combination,Role for Update details relating to Fulfillment service operation
UpBQ Update details relating to Transfer Pricing,TransferPricing,Product Combination,Role for Update details relating to Transfer Pricing service operation
CrCR Create an administrative plan for market information management,FinancialMarketInformationAdministrativePlan,Market Information Management,Role for Create an administrative plan for market information management service operation
ReCR Retrieve details about the financial market information management activity,FinancialMarketInformationAdministrativePlan,Market Information Management,Role for Retrieve details about the financial market information management activity service operation
ReBQ Retrieve details about the consolidation of source data,Consolidation,Market Information Management,Role for Retrieve details about the consolidation of source data service operation
ReBQ Retrieve details about the data improvement activities,Improvement,Market Information Management,Role for Retrieve details about the data improvement activities service operation
CrBQ Create a specific report view of the financial market information,Reporting,Market Information Management,Role for Create a specific report view of the financial market information service operation
UpBQ Update properties of a structured view/report,Reporting,Market Information Management,Role for Update properties of a structured view/report service operation
CaBQ Capture usage details for the managed financial information/reports,Reporting,Market Information Management,Role for Capture usage details for the managed financial information/reports service operation
ExBQ Execute an automated action for a report,Reporting,Market Information Management,Role for Execute an automated action for a report service operation
RqBQ Request manual intervention,Reporting,Market Information Management,Role for Request manual intervention service operation
ReBQ Retrieve details about managed financial market reporting activity,Reporting,Market Information Management,Role for Retrieve details about managed financial market reporting activity service operation
Control Traded Position Operating Session,TradedPositionOperatingSession,Trader Position Operations,Role for Control Traded Position Operating Session service operation
Exchange Traded Position Operating Session,TradedPositionOperatingSession,Trader Position Operations,Role for Exchange Traded Position Operating Session service operation
Execute Traded Position Operating Session,TradedPositionOperatingSession,Trader Position Operations,Role for Execute Traded Position Operating Session service operation
Initiate Traded Position Operating Session,TradedPositionOperatingSession,Trader Position Operations,Role for Initiate Traded Position Operating Session service operation
Notify Traded Position Operating Session,TradedPositionOperatingSession,Trader Position Operations,Role for Notify Traded Position Operating Session service operation
Request Traded Position Operating Session,TradedPositionOperatingSession,Trader Position Operations,Role for Request Traded Position Operating Session service operation
Retrieve Traded Position Operating Session,TradedPositionOperatingSession,Trader Position Operations,Role for Retrieve Traded Position Operating Session service operation
Update Traded Position Operating Session,TradedPositionOperatingSession,Trader Position Operations,Role for Update Traded Position Operating Session service operation
Exchange Trade Capture and Reporting Function,TradeCaptureandReporting,Trader Position Operations,Role for Exchange Trade Capture and Reporting Function service operation
Exchange Trade Deal Blotter Function,TradeDealBlotter,Trader Position Operations,Role for Exchange Trade Deal Blotter Function service operation
Exchange Trade Quote and Pricing Function,TradeQuoteandPricing,Trader Position Operations,Role for Exchange Trade Quote and Pricing Function service operation
Exchange Trader Security Position Management and Analysis Function,TraderSecurityPositionManagementandAnalysis,Trader Position Operations,Role for Exchange Trader Security Position Management and Analysis Function service operation
Exchange Trader Trading Permissions and Limits Function,TraderTradingPermissionsandLimits,Trader Position Operations,Role for Exchange Trader Trading Permissions and Limits Function service operation
Execute Trade Capture and Reporting Function,TradeCaptureandReporting,Trader Position Operations,Role for Execute Trade Capture and Reporting Function service operation
Execute Trade Deal Blotter Function,TradeDealBlotter,Trader Position Operations,Role for Execute Trade Deal Blotter Function service operation
Execute Trade Quote and Pricing Function,TradeQuoteandPricing,Trader Position Operations,Role for Execute Trade Quote and Pricing Function service operation
Execute Trader Security Position Management and Analysis Function,TraderSecurityPositionManagementandAnalysis,Trader Position Operations,Role for Execute Trader Security Position Management and Analysis Function service operation
Execute Trader Trading Permissions and Limits Function,TraderTradingPermissionsandLimits,Trader Position Operations,Role for Execute Trader Trading Permissions and Limits Function service operation
Initiate Trade Capture and Reporting Function,TradeCaptureandReporting,Trader Position Operations,Role for Initiate Trade Capture and Reporting Function service operation
Initiate Trade Deal Blotter Function,TradeDealBlotter,Trader Position Operations,Role for Initiate Trade Deal Blotter Function service operation
Initiate Trade Quote and Pricing Function,TradeQuoteandPricing,Trader Position Operations,Role for Initiate Trade Quote and Pricing Function service operation
Initiate Trader Security Position Management and Analysis Function,TraderSecurityPositionManagementandAnalysis,Trader Position Operations,Role for Initiate Trader Security Position Management and Analysis Function service operation
Initiate Trader Trading Permissions and Limits Function,TraderTradingPermissionsandLimits,Trader Position Operations,Role for Initiate Trader Trading Permissions and Limits Function service operation
Notify Trade Capture and Reporting Function,TradeCaptureandReporting,Trader Position Operations,Role for Notify Trade Capture and Reporting Function service operation
Notify Trade Deal Blotter Function,TradeDealBlotter,Trader Position Operations,Role for Notify Trade Deal Blotter Function service operation
Notify Trade Quote and Pricing Function,TradeQuoteandPricing,Trader Position Operations,Role for Notify Trade Quote and Pricing Function service operation
Notify Trader Security Position Management and Analysis Function,TraderSecurityPositionManagementandAnalysis,Trader Position Operations,Role for Notify Trader Security Position Management and Analysis Function service operation
Notify Trader Trading Permissions and Limits Function,TraderTradingPermissionsandLimits,Trader Position Operations,Role for Notify Trader Trading Permissions and Limits Function service operation
Request Trade Capture and Reporting Function,TradeCaptureandReporting,Trader Position Operations,Role for Request Trade Capture and Reporting Function service operation
Request Trade Deal Blotter Function,TradeDealBlotter,Trader Position Operations,Role for Request Trade Deal Blotter Function service operation
Request Trade Quote and Pricing Function,TradeQuoteandPricing,Trader Position Operations,Role for Request Trade Quote and Pricing Function service operation
Request Trader Security Position Management and Analysis Function,TraderSecurityPositionManagementandAnalysis,Trader Position Operations,Role for Request Trader Security Position Management and Analysis Function service operation
Request Trader Trading Permissions and Limits Function,TraderTradingPermissionsandLimits,Trader Position Operations,Role for Request Trader Trading Permissions and Limits Function service operation
Retrieve Trade Capture and Reporting Function,TradeCaptureandReporting,Trader Position Operations,Role for Retrieve Trade Capture and Reporting Function service operation
Retrieve Trade Deal Blotter Function,TradeDealBlotter,Trader Position Operations,Role for Retrieve Trade Deal Blotter Function service operation
Retrieve Trade Quote and Pricing Function,TradeQuoteandPricing,Trader Position Operations,Role for Retrieve Trade Quote and Pricing Function service operation
Retrieve Trader Security Position Management and Analysis Function,TraderSecurityPositionManagementandAnalysis,Trader Position Operations,Role for Retrieve Trader Security Position Management and Analysis Function service operation
Retrieve Trader Trading Permissions and Limits Function,TraderTradingPermissionsandLimits,Trader Position Operations,Role for Retrieve Trader Trading Permissions and Limits Function service operation
Update Trade Capture and Reporting Function,TradeCaptureandReporting,Trader Position Operations,Role for Update Trade Capture and Reporting Function service operation
Update Trade Deal Blotter Function,TradeDealBlotter,Trader Position Operations,Role for Update Trade Deal Blotter Function service operation
Update Trade Quote and Pricing Function,TradeQuoteandPricing,Trader Position Operations,Role for Update Trade Quote and Pricing Function service operation
Update Trader Security Position Management and Analysis Function,TraderSecurityPositionManagementandAnalysis,Trader Position Operations,Role for Update Trader Security Position Management and Analysis Function service operation
Update Trader Trading Permissions and Limits Function,TraderTradingPermissionsandLimits,Trader Position Operations,Role for Update Trader Trading Permissions and Limits Function service operation
ExCR Execute an available automated action for Customer Case Root Cause Analysis,CustomerCaseRootCauseAnalysis,Case Root Cause Analysis,Role for Execute an available automated action for Customer Case Root Cause Analysis service operation
InCR Instantiate a new Customer Case Root Cause Analysis,CustomerCaseRootCauseAnalysis,Case Root Cause Analysis,Role for Instantiate a new Customer Case Root Cause Analysis service operation
ReCR Retrieve details about any aspect of Customer Case Root Cause Analysis,CustomerCaseRootCauseAnalysis,Case Root Cause Analysis,Role for Retrieve details about any aspect of Customer Case Root Cause Analysis service operation
RqCR Request manual intervention or a decision with respect to Customer Case Root Cause Analysis,CustomerCaseRootCauseAnalysis,Case Root Cause Analysis,Role for Request manual intervention or a decision with respect to Customer Case Root Cause Analysis service operation
UpCR Update details relating to Customer Case Root Cause Analysis,CustomerCaseRootCauseAnalysis,Case Root Cause Analysis,Role for Update details relating to Customer Case Root Cause Analysis service operation
ExBQ Execute an available automated action for Credit and Fraud Related Issue Analysis,CreditandFraudRelatedIssueAnalysis,Case Root Cause Analysis,Role for Execute an available automated action for Credit and Fraud Related Issue Analysis service operation
ExBQ Execute an available automated action for Operations and Servicing Issue Analysis,OperationsandServicingIssueAnalysis,Case Root Cause Analysis,Role for Execute an available automated action for Operations and Servicing Issue Analysis service operation
ExBQ Execute an available automated action for Product and Service issue Analysis,ProductandServiceIssueAnalysis,Case Root Cause Analysis,Role for Execute an available automated action for Product and Service issue Analysis service operation
InBQ Instantiate a new Credit and Fraud Related Issue Analysis,CreditandFraudRelatedIssueAnalysis,Case Root Cause Analysis,Role for Instantiate a new Credit and Fraud Related Issue Analysis service operation
InBQ Instantiate a new Operations and Servicing Issue Analysis,OperationsandServicingIssueAnalysis,Case Root Cause Analysis,Role for Instantiate a new Operations and Servicing Issue Analysis service operation
