Service Operation,baseCRBQName,Service Domain,Role Definition
Request Document Directory Entry,DocumentDirectoryEntry,Document Directory,Role for Request Document Directory Entry service operation
Control Document Directory Entry,DocumentDirectoryEntry,Document Directory,Role for Control Document Directory Entry service operation
Execute Document Directory Entry,DocumentDirectoryEntry,Document Directory,Role for Execute Document Directory Entry service operation
Notify Document Directory Entry,DocumentDirectoryEntry,Document Directory,Role for Notify Document Directory Entry service operation
Register Document Directory Entry,DocumentDirectoryEntry,Document Directory,Role for Register Document Directory Entry service operation
Retrieve Document Directory Entry,DocumentDirectoryEntry,Document Directory,Role for Retrieve Document Directory Entry service operation
Update Document Directory Entry,DocumentDirectoryEntry,Document Directory,Role for Update Document Directory Entry service operation
Execute Document Amendment Properties,DocumentAmendmentProperties,Document Directory,Role for Execute Document Amendment Properties service operation
Execute Document Archiving Properties,DocumentArchivingProperties,Document Directory,Role for Execute Document Archiving Properties service operation
Execute Document Reference Properties,DocumentReferenceProperties,Document Directory,Role for Execute Document Reference Properties service operation
Execute Document Update History Properties,DocumentUpdateHistoryProperties,Document Directory,Role for Execute Document Update History Properties service operation
Execute Document Verification Properties,DocumentVerificationProperties,Document Directory,Role for Execute Document Verification Properties service operation
Execute Document Version Properties,DocumentVersionProperties,Document Directory,Role for Execute Document Version Properties service operation
Notify Document Amendment Properties,DocumentAmendmentProperties,Document Directory,Role for Notify Document Amendment Properties service operation
Notify Document Archiving Properties,DocumentArchivingProperties,Document Directory,Role for Notify Document Archiving Properties service operation
Notify Document Reference Properties,DocumentReferenceProperties,Document Directory,Role for Notify Document Reference Properties service operation
Notify Document Update History Properties,DocumentUpdateHistoryProperties,Document Directory,Role for Notify Document Update History Properties service operation
Notify Document Verification Properties,DocumentVerificationProperties,Document Directory,Role for Notify Document Verification Properties service operation
Notify Document Version Properties,DocumentVersionProperties,Document Directory,Role for Notify Document Version Properties service operation
Register Document Amendment Properties,DocumentAmendmentProperties,Document Directory,Role for Register Document Amendment Properties service operation
Register Document Archiving Properties,DocumentArchivingProperties,Document Directory,Role for Register Document Archiving Properties service operation
Register Document Reference Properties,DocumentReferenceProperties,Document Directory,Role for Register Document Reference Properties service operation
Register Document Update History Properties,DocumentUpdateHistoryProperties,Document Directory,Role for Register Document Update History Properties service operation
Register Document Verification Properties,DocumentVerificationProperties,Document Directory,Role for Register Document Verification Properties service operation
Register Document Version Properties,DocumentVersionProperties,Document Directory,Role for Register Document Version Properties service operation
Request Document Amendment Properties,DocumentAmendmentProperties,Document Directory,Role for Request Document Amendment Properties service operation
Request Document Archiving Properties,DocumentArchivingProperties,Document Directory,Role for Request Document Archiving Properties service operation
Request Document Reference Properties,DocumentReferenceProperties,Document Directory,Role for Request Document Reference Properties service operation
Request Document Update History Properties,DocumentUpdateHistoryProperties,Document Directory,Role for Request Document Update History Properties service operation
Request Document Verification Properties,DocumentVerificationProperties,Document Directory,Role for Request Document Verification Properties service operation
Request Document Version Properties,DocumentVersionProperties,Document Directory,Role for Request Document Version Properties service operation
Retrieve Document Amendment Properties,DocumentAmendmentProperties,Document Directory,Role for Retrieve Document Amendment Properties service operation
Retrieve Document Archiving Properties,DocumentArchivingProperties,Document Directory,Role for Retrieve Document Archiving Properties service operation
Retrieve Document Reference Properties,DocumentReferenceProperties,Document Directory,Role for Retrieve Document Reference Properties service operation
Retrieve Document Update History Properties,DocumentUpdateHistoryProperties,Document Directory,Role for Retrieve Document Update History Properties service operation
Retrieve Document Verification Properties,DocumentVerificationProperties,Document Directory,Role for Retrieve Document Verification Properties service operation
Retrieve Document Version Properties,DocumentVersionProperties,Document Directory,Role for Retrieve Document Version Properties service operation
Update Document Amendment Properties,DocumentAmendmentProperties,Document Directory,Role for Update Document Amendment Properties service operation
Update Document Archiving Properties,DocumentArchivingProperties,Document Directory,Role for Update Document Archiving Properties service operation
Update Document Reference Properties,DocumentReferenceProperties,Document Directory,Role for Update Document Reference Properties service operation
Update Document Update History Properties,DocumentUpdateHistoryProperties,Document Directory,Role for Update Document Update History Properties service operation
Update Document Verification Properties,DocumentVerificationProperties,Document Directory,Role for Update Document Verification Properties service operation
Update Document Version Properties,DocumentVersionProperties,Document Directory,Role for Update Document Version Properties service operation
CrCR Create an initial relationship management plan,CustomerRelationshipManagementPlan,Customer Relationship Management,Role for Create an initial relationship management plan service operation
UpCR Update details of an active relationship plan,CustomerRelationshipManagementPlan,Customer Relationship Management,Role for Update details of an active relationship plan service operation
CoCR Control the processing of a relationship plan (e.g. suspend),CustomerRelationshipManagementPlan,Customer Relationship Management,Role for Control the processing of a relationship plan (e.g. suspend) service operation
"EcCR Accept, verify, reject aspects of the plan",CustomerRelationshipManagementPlan,Customer Relationship Management,"Role for Accept, verify, reject aspects of the plan service operation"
RqCR Request intervention with a relationship plan (e.g. arrange a customer meeting),CustomerRelationshipManagementPlan,Customer Relationship Management,Role for Request intervention with a relationship plan (e.g. arrange a customer meeting) service operation
GrCR Grant authorization for actions that impact the plan (e.g. qualify eligibility for a campaign),CustomerRelationshipManagementPlan,Customer Relationship Management,Role for Grant authorization for actions that impact the plan (e.g. qualify eligibility for a campaign) service operation
ReCR Retrieve details about a relationship plan,CustomerRelationshipManagementPlan,Customer Relationship Management,Role for Retrieve details about a relationship plan service operation
CrBQ Create customer development capability  (initialize the capability),Development,Customer Relationship Management,Role for Create customer development capability (initialize the capability) service operation
UpBQ Update details about a relationship development task,Development,Customer Relationship Management,Role for Update details about a relationship development task service operation
"EcBQ Accept, reject, verify a development activity",Development,Customer Relationship Management,"Role for Accept, reject, verify a development activity service operation"
RqBQ Request a relationship development task,Development,Customer Relationship Management,Role for Request a relationship development task service operation
ReBQ Retrieve details about relationship development activity,Development,Customer Relationship Management,Role for Retrieve details about relationship development activity service operation
CrBQ Create customer incident reporting capability (initialize the capability),Incident,Customer Relationship Management,Role for Create customer incident reporting capability (initialize the capability) service operation
UpBQ Update details about a customer incident,Incident,Customer Relationship Management,Role for Update details about a customer incident service operation
CoBQ Control the processing of a customer incident (e.g. raise priority),Incident,Customer Relationship Management,Role for Control the processing of a customer incident (e.g. raise priority) service operation
"EcBQ Accept, reject, confirm details about a customer incident",Incident,Customer Relationship Management,"Role for Accept, reject, confirm details about a customer incident service operation"
CaBQ Capture details of a new customer incident,Incident,Customer Relationship Management,Role for Capture details of a new customer incident service operation
ReBQ Retrieve details about a customer incident,Incident,Customer Relationship Management,Role for Retrieve details about a customer incident service operation
CrBQ Create contact handling capability (initialize and track),Contact,Customer Relationship Management,Role for Create contact handling capability (initialize and track) service operation
UpCR Update details of a customer contact,Contact,Customer Relationship Management,Role for Update details of a customer contact service operation
RqBQ Request a customer contact,Contact,Customer Relationship Management,Role for Request a customer contact service operation
ReBQ Retrieve details about customer contacts,Contact,Customer Relationship Management,Role for Retrieve details about customer contacts service operation
UpCR Update aspects of the bank's asset and liability policies,AssetAndLiabilityPortfolioStrategy,Asset And Liability Management,Role for Update aspects of the bank's asset and liability policies service operation
RqCR Request manual intervention in the policies,AssetAndLiabilityPortfolioStrategy,Asset And Liability Management,Role for Request manual intervention in the policies service operation
ReCR Retrieve details about the bank's asset and liability policies,AssetAndLiabilityPortfolioStrategy,Asset And Liability Management,Role for Retrieve details about the bank's asset and liability policies service operation
CrBQ Create a proposed transaction submission under the policy,TransactionAlignment,Asset And Liability Management,Role for Create a proposed transaction submission under the policy service operation
RqBQ Request manual intervention during an assessment,TransactionAlignment,Asset And Liability Management,Role for Request manual intervention during an assessment service operation
ReBQ Retrieve details about a transaction alignment assessment,TransactionAlignment,Asset And Liability Management,Role for Retrieve details about a transaction alignment assessment service operation
EvCR Evaluate an underwriting decision,UnderwritingAssessment,Underwriting,Role for Evaluate an underwriting decision service operation
UpCR Update details for an underwriting assessment,UnderwritingAssessment,Underwriting,Role for Update details for an underwriting assessment service operation
ReCR Retrieve details about an underwriting assessment,UnderwritingAssessment,Underwriting,Role for Retrieve details about an underwriting assessment service operation
CoCR Control the processing of Cheque Processing Operating Session,ChequeProcessingOperatingSession,Cheque Processing,Role for Control the processing of Cheque Processing Operating Session service operation
"EcCR Accept, verify, etc. aspects of Cheque Processing Operating Session processing",ChequeProcessingOperatingSession,Cheque Processing,"Role for Accept, verify, etc. aspects of Cheque Processing Operating Session processing service operation"
ExCR Execute an available automated action for Cheque Processing Operating Session,ChequeProcessingOperatingSession,Cheque Processing,Role for Execute an available automated action for Cheque Processing Operating Session service operation
InCR Instantiate a new Cheque Processing Operating Session,ChequeProcessingOperatingSession,Cheque Processing,Role for Instantiate a new Cheque Processing Operating Session service operation
ReCR Retrieve details about any aspect of Cheque Processing Operating Session,ChequeProcessingOperatingSession,Cheque Processing,Role for Retrieve details about any aspect of Cheque Processing Operating Session service operation
RqCR Request manual intervention or a decision with respect to Cheque Processing Operating Session,ChequeProcessingOperatingSession,Cheque Processing,Role for Request manual intervention or a decision with respect to Cheque Processing Operating Session service operation
UpCR Update details relating to Cheque Processing Operating Session,ChequeProcessingOperatingSession,Cheque Processing,Role for Update details relating to Cheque Processing Operating Session service operation
"EcBQ Accept, verify, etc. aspects of Financial Transaction Initiation processing",FinancialTransactionInitiation,Cheque Processing,"Role for Accept, verify, etc. aspects of Financial Transaction Initiation processing service operation"
Retrieve details about Cancelled Cheque Handling,ChequeExceptionHandling,Cheque Processing,Role for Retrieve details about Cancelled Cheque Handling service operation
ReBQ Retrieve details about any aspect of Cheque Extraction,ChequeExtraction,Cheque Processing,Role for Retrieve details about any aspect of Cheque Extraction service operation
ReBQ Retrieve details about any aspect of Financial Transaction Initiation,FinancialTransactionInitiation,Cheque Processing,Role for Retrieve details about any aspect of Financial Transaction Initiation service operation
Update details of Cancelled Cheque Handling,ChequeExceptionHandling,Cheque Processing,Role for Update details of Cancelled Cheque Handling service operation
Control Customer Proposition Agreement,CustomerPropositionAgreement,Customer Proposition,Role for Control Customer Proposition Agreement service operation
Evaluate Customer Proposition Agreement,CustomerPropositionAgreement,Customer Proposition,Role for Evaluate Customer Proposition Agreement service operation
Exchange Customer Proposition Agreement,CustomerPropositionAgreement,Customer Proposition,Role for Exchange Customer Proposition Agreement service operation
Grant Customer Proposition Agreement,CustomerPropositionAgreement,Customer Proposition,Role for Grant Customer Proposition Agreement service operation
Notify Customer Proposition Agreement,CustomerPropositionAgreement,Customer Proposition,Role for Notify Customer Proposition Agreement service operation
Request Customer Proposition Agreement,CustomerPropositionAgreement,Customer Proposition,Role for Request Customer Proposition Agreement service operation
Retrieve Customer Proposition Agreement,CustomerPropositionAgreement,Customer Proposition,Role for Retrieve Customer Proposition Agreement service operation
Update Customer Proposition Agreement,CustomerPropositionAgreement,Customer Proposition,Role for Update Customer Proposition Agreement service operation
Evaluate Bank Defined Product and Service Term,BankDefinedProductandServiceTerm,Customer Proposition,Role for Evaluate Bank Defined Product and Service Term service operation
Evaluate Customer Defined Product and Service Term,CustomerDefinedProductandServiceTerm,Customer Proposition,Role for Evaluate Customer Defined Product and Service Term service operation
Exchange Bank Defined Product and Service Term,BankDefinedProductandServiceTerm,Customer Proposition,Role for Exchange Bank Defined Product and Service Term service operation
Exchange Customer Defined Product and Service Term,CustomerDefinedProductandServiceTerm,Customer Proposition,Role for Exchange Customer Defined Product and Service Term service operation
Notify Bank Defined Product and Service Term,BankDefinedProductandServiceTerm,Customer Proposition,Role for Notify Bank Defined Product and Service Term service operation
Notify Customer Defined Product and Service Term,CustomerDefinedProductandServiceTerm,Customer Proposition,Role for Notify Customer Defined Product and Service Term service operation
Request Bank Defined Product and Service Term,BankDefinedProductandServiceTerm,Customer Proposition,Role for Request Bank Defined Product and Service Term service operation
Request Customer Defined Product and Service Term,CustomerDefinedProductandServiceTerm,Customer Proposition,Role for Request Customer Defined Product and Service Term service operation
Retrieve Bank Defined Product and Service Term,BankDefinedProductandServiceTerm,Customer Proposition,Role for Retrieve Bank Defined Product and Service Term service operation
Retrieve Customer Defined Product and Service Term,CustomerDefinedProductandServiceTerm,Customer Proposition,Role for Retrieve Customer Defined Product and Service Term service operation
Update Bank Defined Product and Service Term,BankDefinedProductandServiceTerm,Customer Proposition,Role for Update Bank Defined Product and Service Term service operation
Update Customer Defined Product and Service Term,CustomerDefinedProductandServiceTerm,Customer Proposition,Role for Update Customer Defined Product and Service Term service operation
EvCR Establish a managed investment portfolio agreement,ManagedInvestmentPortfolioAgreement,Investment Portfolio Planning,Role for Establish a managed investment portfolio agreement service operation
UpCR Update details of an active managed investment portfolio agreement,ManagedInvestmentPortfolioAgreement,Investment Portfolio Planning,Role for Update details of an active managed investment portfolio agreement service operation
RqCR Request review that proposed activity is compatible with the agreement,ManagedInvestmentPortfolioAgreement,Investment Portfolio Planning,Role for Request review that proposed activity is compatible with the agreement service operation
ReCR Retrieve details about a managed investment portfolio agreement,ManagedInvestmentPortfolioAgreement,Investment Portfolio Planning,Role for Retrieve details about a managed investment portfolio agreement service operation
EvBQ Establish the specific terms/conditions making up the investment agreement,InvestmentTerms,Investment Portfolio Planning,Role for Establish the specific terms/conditions making up the investment agreement service operation
UpBQ Update the terms/conditions for an investment agreement,InvestmentTerms,Investment Portfolio Planning,Role for Update the terms/conditions for an investment agreement service operation
RqBQ Request check of a proposed activity is compatible with a specific term of the agreement,InvestmentTerms,Investment Portfolio Planning,Role for Request check of a proposed activity is compatible with a specific term of the agreement service operation
ReBQ Retrieve details about the specific terms of an agreement,InvestmentTerms,Investment Portfolio Planning,Role for Retrieve details about the specific terms of an agreement service operation
CoCR Control the processing of Direct Debit Facility,DirectDebitFacility,Direct Debit,Role for Control the processing of Direct Debit Facility service operation
"EcCR Accept, verify, etc. aspects of Direct Debit Facility processing",DirectDebitFacility,Direct Debit,"Role for Accept, verify, etc. aspects of Direct Debit Facility processing service operation"
ExCR Execute an available automated action for Direct Debit Facility,DirectDebitFacility,Direct Debit,Role for Execute an available automated action for Direct Debit Facility service operation
InCR Instantiate a new Direct Debit Facility,DirectDebitFacility,Direct Debit,Role for Instantiate a new Direct Debit Facility service operation
ReCR Retrieve details about any aspect of Direct Debit Facility,DirectDebitFacility,Direct Debit,Role for Retrieve details about any aspect of Direct Debit Facility service operation
RqCR Request manual intervention or a decision with respect to Direct Debit Facility,DirectDebitFacility,Direct Debit,Role for Request manual intervention or a decision with respect to Direct Debit Facility service operation
UpCR Update details relating to Direct Debit Facility,DirectDebitFacility,Direct Debit,Role for Update details relating to Direct Debit Facility service operation
CoBQ Control the processing of Payment Tracking,PaymentTracking,Direct Debit,Role for Control the processing of Payment Tracking service operation
"EcBQ Accept, verify, etc. aspects of Funds Available Check processing",FundsAvailableCheck,Direct Debit,"Role for Accept, verify, etc. aspects of Funds Available Check processing service operation"
"EcBQ Accept, verify, etc. aspects of Payment Initiation processing",PaymentInitiation,Direct Debit,"Role for Accept, verify, etc. aspects of Payment Initiation processing service operation"
"EcBQ Accept, verify, etc. aspects of Verify Mandate processing",VerifyMandate,Direct Debit,"Role for Accept, verify, etc. aspects of Verify Mandate processing service operation"
ExBQ Execute an available automated action for Payment Tracking,PaymentTracking,Direct Debit,Role for Execute an available automated action for Payment Tracking service operation
InBQ Instantiate a new Payment Tracking,PaymentTracking,Direct Debit,Role for Instantiate a new Payment Tracking service operation
InBQ Instantiate a new Reporting,Reporting,Direct Debit,Role for Instantiate a new Reporting service operation
ReBQ Retrieve details about any aspect of Funds Available Check,FundsAvailableCheck,Direct Debit,Role for Retrieve details about any aspect of Funds Available Check service operation
ReBQ Retrieve details about any aspect of Payment Initiation,PaymentInitiation,Direct Debit,Role for Retrieve details about any aspect of Payment Initiation service operation
ReBQ Retrieve details about any aspect of Payment Tracking,PaymentTracking,Direct Debit,Role for Retrieve details about any aspect of Payment Tracking service operation
ReBQ Retrieve details about any aspect of Reporting,Reporting,Direct Debit,Role for Retrieve details about any aspect of Reporting service operation
ReBQ Retrieve details about any aspect of Verify Mandate,VerifyMandate,Direct Debit,Role for Retrieve details about any aspect of Verify Mandate service operation
RqBQ Request manual intervention or a decision with respect to Funds Available Check,FundsAvailableCheck,Direct Debit,Role for Request manual intervention or a decision with respect to Funds Available Check service operation
EvCR Establish a customer access profile agreement,CustomerAccessProfileAgreement,Customer Access Entitlement,Role for Establish a customer access profile agreement service operation
UpCR Update details of a customer access profile agreement,CustomerAccessProfileAgreement,Customer Access Entitlement,Role for Update details of a customer access profile agreement service operation
CoCR Control the handling of a customer access profile (e.g. suspend),CustomerAccessProfileAgreement,Customer Access Entitlement,Role for Control the handling of a customer access profile (e.g. suspend) service operation
"EcCR Accept, verify, etc. a customer access profile agreement",CustomerAccessProfileAgreement,Customer Access Entitlement,"Role for Accept, verify, etc. a customer access profile agreement service operation"
RqCR Request manual intervention in a customer access profile (e.g. handle exceptions),CustomerAccessProfileAgreement,Customer Access Entitlement,Role for Request manual intervention in a customer access profile (e.g. handle exceptions) service operation
GrCR Grant access under the agreement,CustomerAccessProfileAgreement,Customer Access Entitlement,Role for Grant access under the agreement service operation
ReCR Retrieve details about a customer access profile agreement,CustomerAccessProfileAgreement,Customer Access Entitlement,Role for Retrieve details about a customer access profile agreement service operation
EvBQ Establish restrictions for the access profile agreement,Restrictions,Customer Access Entitlement,Role for Establish restrictions for the access profile agreement service operation
UpBQ Update details for the restrictions in the agreement,Restrictions,Customer Access Entitlement,Role for Update details for the restrictions in the agreement service operation
ReBQ Retrieve details about the restrictions in the agreement,Restrictions,Customer Access Entitlement,Role for Retrieve details about the restrictions in the agreement service operation
EvBQ Establish preferences for the access profile agreement,Preferences,Customer Access Entitlement,Role for Establish preferences for the access profile agreement service operation
UpBQ Update details for the preferences in the agreement,Preferences,Customer Access Entitlement,Role for Update details for the preferences in the agreement service operation
