Service Operation,baseCRBQName,Service Domain,Role Definition
ReCR Retrieve details about any aspect of Enterprise Architecture Specification,EnterpriseArchitectureSpecification,Enterprise Architecture,Role for Retrieve details about any aspect of Enterprise Architecture Specification service operation
RqCR Request manual intervention or a decision with respect to Enterprise Architecture Specification,EnterpriseArchitectureSpecification,Enterprise Architecture,Role for Request manual intervention or a decision with respect to Enterprise Architecture Specification service operation
UpCR Update details relating to Enterprise Architecture Specification,EnterpriseArchitectureSpecification,Enterprise Architecture,Role for Update details relating to Enterprise Architecture Specification service operation
CaBQ Capture Application Architecture activity or event related information,ApplicationArchitecture,Enterprise Architecture,Role for Capture Application Architecture activity or event related information service operation
CaBQ Capture Business Architecture activity or event related information,BusinessArchitecture,Enterprise Architecture,Role for Capture Business Architecture activity or event related information service operation
CaBQ Capture Information Architecture activity or event related information,InformationArchitecture,Enterprise Architecture,Role for Capture Information Architecture activity or event related information service operation
CaBQ Capture Organization activity or event related information,Organization,Enterprise Architecture,Role for Capture Organization activity or event related information service operation
CaBQ Capture Technology Infrastructure activity or event related information,TechnologyInfrastructure,Enterprise Architecture,Role for Capture Technology Infrastructure activity or event related information service operation
ReBQ Retrieve details about any aspect of Application Architecture,ApplicationArchitecture,Enterprise Architecture,Role for Retrieve details about any aspect of Application Architecture service operation
ReBQ Retrieve details about any aspect of Business Architecture,BusinessArchitecture,Enterprise Architecture,Role for Retrieve details about any aspect of Business Architecture service operation
ReBQ Retrieve details about any aspect of Information Architecture,InformationArchitecture,Enterprise Architecture,Role for Retrieve details about any aspect of Information Architecture service operation
ReBQ Retrieve details about any aspect of Organization,Organization,Enterprise Architecture,Role for Retrieve details about any aspect of Organization service operation
ReBQ Retrieve details about any aspect of Technology Infrastructure,TechnologyInfrastructure,Enterprise Architecture,Role for Retrieve details about any aspect of Technology Infrastructure service operation
RqBQ Request manual intervention or a decision with respect to Application Architecture,ApplicationArchitecture,Enterprise Architecture,Role for Request manual intervention or a decision with respect to Application Architecture service operation
RqBQ Request manual intervention or a decision with respect to Business Architecture,BusinessArchitecture,Enterprise Architecture,Role for Request manual intervention or a decision with respect to Business Architecture service operation
RqBQ Request manual intervention or a decision with respect to Information Architecture,InformationArchitecture,Enterprise Architecture,Role for Request manual intervention or a decision with respect to Information Architecture service operation
RqBQ Request manual intervention or a decision with respect to Organization,Organization,Enterprise Architecture,Role for Request manual intervention or a decision with respect to Organization service operation
RqBQ Request manual intervention or a decision with respect to Technology Infrastructure,TechnologyInfrastructure,Enterprise Architecture,Role for Request manual intervention or a decision with respect to Technology Infrastructure service operation
UpBQ Update details relating to Application Architecture,ApplicationArchitecture,Enterprise Architecture,Role for Update details relating to Application Architecture service operation
UpBQ Update details relating to Business Architecture,BusinessArchitecture,Enterprise Architecture,Role for Update details relating to Business Architecture service operation
UpBQ Update details relating to Information Architecture,InformationArchitecture,Enterprise Architecture,Role for Update details relating to Information Architecture service operation
UpBQ Update details relating to Organization,Organization,Enterprise Architecture,Role for Update details relating to Organization service operation
UpBQ Update details relating to Technology Infrastructure,TechnologyInfrastructure,Enterprise Architecture,Role for Update details relating to Technology Infrastructure service operation
InCR Initiate channel activity logging for a customer,ChannelActivityLog,Channel Activity History,Role for Initiate channel activity logging for a customer service operation
UpCR Update channel activity logging details for a customer,ChannelActivityLog,Channel Activity History,Role for Update channel activity logging details for a customer service operation
ReCR Retrieve details about customer channel activity logging,ChannelActivityLog,Channel Activity History,Role for Retrieve details about customer channel activity logging service operation
UpBQ Update a logged event for a customer,Event,Channel Activity History,Role for Update a logged event for a customer service operation
CaBQ Capture a channel access event in the log,Event,Channel Activity History,Role for Capture a channel access event in the log service operation
ReBQ Retrieve details about a logged channel activity event,Event,Channel Activity History,Role for Retrieve details about a logged channel activity event service operation
InCR Initiate a card clearing process,CardClearingProcedure,Card Clearing,Role for Initiate a card clearing process service operation
UpCR Update details of a card clearing processing batch,CardClearingProcedure,Card Clearing,Role for Update details of a card clearing processing batch service operation
ReCR Retrieve details about a card clearing process,CardClearingProcedure,Card Clearing,Role for Retrieve details about a card clearing process service operation
UpBQ Update details of a captured card transaction (for repair),Capture,Card Clearing,Role for Update details of a captured card transaction (for repair) service operation
ReBQ Retrieve details about a captured card transaction,Capture,Card Clearing,Role for Retrieve details about a captured card transaction service operation
ReBQ Retrieve details about card transaction addressing,Addressing,Card Clearing,Role for Retrieve details about card transaction addressing service operation
ReBQ Retrieve details about card transaction FX conversion|,FXConversion,Card Clearing,Role for Retrieve details about card transaction FX conversion| service operation
UpBQ Update details of applied fees,Fees,Card Clearing,Role for Update details of applied fees service operation
ReBQ Retrieve details about card transaction intercharge fees,Fees,Card Clearing,Role for Retrieve details about card transaction intercharge fees service operation
ReBQ Retrieve details about card transaction matching,Matching,Card Clearing,Role for Retrieve details about card transaction matching service operation
ReBQ Retrieve details about card transaction reconciliation,Reconciliation,Card Clearing,Role for Retrieve details about card transaction reconciliation service operation
ReBQ Retrieve details about card transaction routing,Routing,Card Clearing,Role for Retrieve details about card transaction routing service operation
InCR Initiate a servicing order,ServicingOrderProcedure,Servicing Order,Role for Initiate a servicing order service operation
ExCR Execute an automated task in a servicing order (e.g. upload data),ServicingOrderProcedure,Servicing Order,Role for Execute an automated task in a servicing order (e.g. upload data) service operation
RqCR Request manual intervention in a servicing order (e.g. engage a servicing agent),ServicingOrderProcedure,Servicing Order,Role for Request manual intervention in a servicing order (e.g. engage a servicing agent) service operation
ReCR Retrieve details about a servicing order,ServicingOrderProcedure,Servicing Order,Role for Retrieve details about a servicing order service operation
Control Operational Gateway Operating Session,OperationalGatewayOperatingSession,Operational Gateway,Role for Control Operational Gateway Operating Session service operation
Exchange Operational Gateway Operating Session,OperationalGatewayOperatingSession,Operational Gateway,Role for Exchange Operational Gateway Operating Session service operation
Execute Operational Gateway Operating Session,OperationalGatewayOperatingSession,Operational Gateway,Role for Execute Operational Gateway Operating Session service operation
Initiate Operational Gateway Operating Session,OperationalGatewayOperatingSession,Operational Gateway,Role for Initiate Operational Gateway Operating Session service operation
Notify Operational Gateway Operating Session,OperationalGatewayOperatingSession,Operational Gateway,Role for Notify Operational Gateway Operating Session service operation
Request Operational Gateway Operating Session,OperationalGatewayOperatingSession,Operational Gateway,Role for Request Operational Gateway Operating Session service operation
Retrieve Operational Gateway Operating Session,OperationalGatewayOperatingSession,Operational Gateway,Role for Retrieve Operational Gateway Operating Session service operation
Update Operational Gateway Operating Session,OperationalGatewayOperatingSession,Operational Gateway,Role for Update Operational Gateway Operating Session service operation
Exchange Inbound Message Function,InboundMessage,Operational Gateway,Role for Exchange Inbound Message Function service operation
Exchange Outbound Message Function,OutboundMessage,Operational Gateway,Role for Exchange Outbound Message Function service operation
Exchange Outbound With Response Function,OutboundWithResponse,Operational Gateway,Role for Exchange Outbound With Response Function service operation
Execute Inbound Message Function,InboundMessage,Operational Gateway,Role for Execute Inbound Message Function service operation
Execute Outbound Message Function,OutboundMessage,Operational Gateway,Role for Execute Outbound Message Function service operation
Execute Outbound With Response Function,OutboundWithResponse,Operational Gateway,Role for Execute Outbound With Response Function service operation
Initiate Inbound Message Function,InboundMessage,Operational Gateway,Role for Initiate Inbound Message Function service operation
Initiate Outbound Message Function,OutboundMessage,Operational Gateway,Role for Initiate Outbound Message Function service operation
Initiate Outbound With Response Function,OutboundWithResponse,Operational Gateway,Role for Initiate Outbound With Response Function service operation
Notify Inbound Message Function,InboundMessage,Operational Gateway,Role for Notify Inbound Message Function service operation
Notify Outbound Message Function,OutboundMessage,Operational Gateway,Role for Notify Outbound Message Function service operation
Notify Outbound With Response Function,OutboundWithResponse,Operational Gateway,Role for Notify Outbound With Response Function service operation
Request Inbound Message Function,InboundMessage,Operational Gateway,Role for Request Inbound Message Function service operation
Request Outbound Message Function,OutboundMessage,Operational Gateway,Role for Request Outbound Message Function service operation
Request Outbound With Response Function,OutboundWithResponse,Operational Gateway,Role for Request Outbound With Response Function service operation
Retrieve Inbound Message Function,InboundMessage,Operational Gateway,Role for Retrieve Inbound Message Function service operation
Retrieve Outbound Message Function,OutboundMessage,Operational Gateway,Role for Retrieve Outbound Message Function service operation
Retrieve Outbound With Response Function,OutboundWithResponse,Operational Gateway,Role for Retrieve Outbound With Response Function service operation
Update Inbound Message Function,InboundMessage,Operational Gateway,Role for Update Inbound Message Function service operation
Update Outbound Message Function,OutboundMessage,Operational Gateway,Role for Update Outbound Message Function service operation
Update Outbound With Response Function,OutboundWithResponse,Operational Gateway,Role for Update Outbound With Response Function service operation
EvCR Start a fraud diagnosis evaluation on a transaction,FraudDiagnosisAnalysis,Fraud Diagnosis,Role for Start a fraud diagnosis evaluation on a transaction service operation
UpCR Update details for an active fraud diagnosis,FraudDiagnosisAnalysis,Fraud Diagnosis,Role for Update details for an active fraud diagnosis service operation
ReCR Retrieve details about a fraud diagnosis,FraudDiagnosisAnalysis,Fraud Diagnosis,Role for Retrieve details about a fraud diagnosis service operation
ReBQ Retrieve details about a customer behavior analysis,CustomerBehavior,Fraud Diagnosis,Role for Retrieve details about a customer behavior analysis service operation
ReBQ Retrieve details about an economic model analysis,EconomicModel,Fraud Diagnosis,Role for Retrieve details about an economic model analysis service operation
RqBQ Request access to an analist for an active diagnosis,AnalystReview,Fraud Diagnosis,Role for Request access to an analist for an active diagnosis service operation
ReBQ Retrieve details about a analyst review of a transaction,AnalystReview,Fraud Diagnosis,Role for Retrieve details about a analyst review of a transaction service operation
InCR Initiate a consumer advisory session,ConsumerAdviceFacility,Consumer Advisory Services,Role for Initiate a consumer advisory session service operation
UpCR Update details for a consumer advisory session,ConsumerAdviceFacility,Consumer Advisory Services,Role for Update details for a consumer advisory session service operation
RqCR Request manual intervention in a session,ConsumerAdviceFacility,Consumer Advisory Services,Role for Request manual intervention in a session service operation
ReCR Retrieve details about a consumer advisory session,ConsumerAdviceFacility,Consumer Advisory Services,Role for Retrieve details about a consumer advisory session service operation
InBQ Initiate financial planning advisory session,FinancialPlanning,Consumer Advisory Services,Role for Initiate financial planning advisory session service operation
UpBQ Update details about a financial planning advisory session,FinancialPlanning,Consumer Advisory Services,Role for Update details about a financial planning advisory session service operation
ReBQ Retrieve details about a financial planning advisory session,FinancialPlanning,Consumer Advisory Services,Role for Retrieve details about a financial planning advisory session service operation
InBQ Initiate tax optimization advisory session,TaxOptimization,Consumer Advisory Services,Role for Initiate tax optimization advisory session service operation
UpBQ Update details about a tax optimization advisory session,TaxOptimization,Consumer Advisory Services,Role for Update details about a tax optimization advisory session service operation
ReBQ Retrieve details about a tax optimization advisory session,TaxOptimization,Consumer Advisory Services,Role for Retrieve details about a tax optimization advisory session service operation
InBQ Initiate product guidance advisory session,ProductGuidance,Consumer Advisory Services,Role for Initiate product guidance advisory session service operation
UpBQ Update details about a product guidance advisory session,ProductGuidance,Consumer Advisory Services,Role for Update details about a product guidance advisory session service operation
ReBQ Retrieve details about a product guidance advisory session,ProductGuidance,Consumer Advisory Services,Role for Retrieve details about a product guidance advisory session service operation
InBQ Initialize service fee processing for an advisory session,ServiceFees,Consumer Advisory Services,Role for Initialize service fee processing for an advisory session service operation
UpBQ Update details of service fees for an advisory session,ServiceFees,Consumer Advisory Services,Role for Update details of service fees for an advisory session service operation
ExBQ Execute/apply a fee for an advisory session,ServiceFees,Consumer Advisory Services,Role for Execute/apply a fee for an advisory session service operation
ReBQ Retrieve details about service fees for an advisory session,ServiceFees,Consumer Advisory Services,Role for Retrieve details about service fees for an advisory session service operation
Control Mergers And Acquisition Advice,MergersAndAcquisitionAdvice,Mergers and Acquisitions Advisory,Role for Control Mergers And Acquisition Advice service operation
Exchange Mergers And Acquisition Advice,MergersAndAcquisitionAdvice,Mergers and Acquisitions Advisory,Role for Exchange Mergers And Acquisition Advice service operation
Execute Mergers And Acquisition Advice,MergersAndAcquisitionAdvice,Mergers and Acquisitions Advisory,Role for Execute Mergers And Acquisition Advice service operation
Initiate Mergers And Acquisition Advice,MergersAndAcquisitionAdvice,Mergers and Acquisitions Advisory,Role for Initiate Mergers And Acquisition Advice service operation
Notify Mergers And Acquisition Advice,MergersAndAcquisitionAdvice,Mergers and Acquisitions Advisory,Role for Notify Mergers And Acquisition Advice service operation
Request Mergers And Acquisition Advice,MergersAndAcquisitionAdvice,Mergers and Acquisitions Advisory,Role for Request Mergers And Acquisition Advice service operation
Retrieve Mergers And Acquisition Advice,MergersAndAcquisitionAdvice,Mergers and Acquisitions Advisory,Role for Retrieve Mergers And Acquisition Advice service operation
Update Mergers And Acquisition Advice,MergersAndAcquisitionAdvice,Mergers and Acquisitions Advisory,Role for Update Mergers And Acquisition Advice service operation
Exchange M&A Candidate Selection and Evaluation Topic,M&ACandidateSelectionandEvaluation,Mergers and Acquisitions Advisory,Role for Exchange M&A Candidate Selection and Evaluation Topic service operation
Execute M&A Candidate Selection and Evaluation Topic,M&ACandidateSelectionandEvaluation,Mergers and Acquisitions Advisory,Role for Execute M&A Candidate Selection and Evaluation Topic service operation
Initiate M&A Candidate Selection and Evaluation Topic,M&ACandidateSelectionandEvaluation,Mergers and Acquisitions Advisory,Role for Initiate M&A Candidate Selection and Evaluation Topic service operation
Notify M&A Candidate Selection and Evaluation Topic,M&ACandidateSelectionandEvaluation,Mergers and Acquisitions Advisory,Role for Notify M&A Candidate Selection and Evaluation Topic service operation
Request M&A Candidate Selection and Evaluation Topic,M&ACandidateSelectionandEvaluation,Mergers and Acquisitions Advisory,Role for Request M&A Candidate Selection and Evaluation Topic service operation
Retrieve M&A Candidate Selection and Evaluation Topic,M&ACandidateSelectionandEvaluation,Mergers and Acquisitions Advisory,Role for Retrieve M&A Candidate Selection and Evaluation Topic service operation
Update M&A Candidate Selection and Evaluation Topic,M&ACandidateSelectionandEvaluation,Mergers and Acquisitions Advisory,Role for Update M&A Candidate Selection and Evaluation Topic service operation
Control Letter Of Credit Transaction,LetterOfCreditTransaction,Letter of Credit,Role for Control Letter Of Credit Transaction service operation
Exchange Letter Of Credit Transaction,LetterOfCreditTransaction,Letter of Credit,Role for Exchange Letter Of Credit Transaction service operation
Execute Letter Of Credit Transaction,LetterOfCreditTransaction,Letter of Credit,Role for Execute Letter Of Credit Transaction service operation
Initiate Letter Of Credit Transaction,LetterOfCreditTransaction,Letter of Credit,Role for Initiate Letter Of Credit Transaction service operation
Notify Letter Of Credit Transaction,LetterOfCreditTransaction,Letter of Credit,Role for Notify Letter Of Credit Transaction service operation
Request Letter Of Credit Transaction,LetterOfCreditTransaction,Letter of Credit,Role for Request Letter Of Credit Transaction service operation
Retrieve Letter Of Credit Transaction,LetterOfCreditTransaction,Letter of Credit,Role for Retrieve Letter Of Credit Transaction service operation
Update Letter Of Credit Transaction,LetterOfCreditTransaction,Letter of Credit,Role for Update Letter Of Credit Transaction service operation
Exchange Customer Collateral Allocation Task,CustomerCollateralAllocation,Letter of Credit,Role for Exchange Customer Collateral Allocation Task service operation
Exchange Customer Payment Task,CustomerPayment,Letter of Credit,Role for Exchange Customer Payment Task service operation
Exchange Letter of Credit Definition and Pricing Task,LetterofCreditDefinitionandPricing,Letter of Credit,Role for Exchange Letter of Credit Definition and Pricing Task service operation
Exchange Letter of Credit Issuance and Booking Task,LetterofCreditIssuance,Letter of Credit,Role for Exchange Letter of Credit Issuance and Booking Task service operation
Exchange Letter of Credit Payout Task,LetterofCreditDemandPayment,Letter of Credit,Role for Exchange Letter of Credit Payout Task service operation
Exchange Seller Obligation Confirmation Task,SellerObligationConfirmation,Letter of Credit,Role for Exchange Seller Obligation Confirmation Task service operation
Execute Customer Collateral Allocation Task,CustomerCollateralAllocation,Letter of Credit,Role for Execute Customer Collateral Allocation Task service operation
Execute Customer Payment Task,CustomerPayment,Letter of Credit,Role for Execute Customer Payment Task service operation
Execute Letter of Credit Definition and Pricing Task,LetterofCreditDefinitionandPricing,Letter of Credit,Role for Execute Letter of Credit Definition and Pricing Task service operation
Execute Letter of Credit Issuance and Booking Task,LetterofCreditIssuance,Letter of Credit,Role for Execute Letter of Credit Issuance and Booking Task service operation
Execute Letter of Credit Payout Task,LetterofCreditDemandPayment,Letter of Credit,Role for Execute Letter of Credit Payout Task service operation
Execute Seller Obligation Confirmation Task,SellerObligationConfirmation,Letter of Credit,Role for Execute Seller Obligation Confirmation Task service operation
Initiate Customer Collateral Allocation Task,CustomerCollateralAllocation,Letter of Credit,Role for Initiate Customer Collateral Allocation Task service operation
Initiate Customer Payment Task,CustomerPayment,Letter of Credit,Role for Initiate Customer Payment Task service operation
Initiate Letter of Credit Definition and Pricing Task,LetterofCreditDefinitionandPricing,Letter of Credit,Role for Initiate Letter of Credit Definition and Pricing Task service operation
Initiate Letter of Credit Issuance and Booking Task,LetterofCreditIssuance,Letter of Credit,Role for Initiate Letter of Credit Issuance and Booking Task service operation
Initiate Letter of Credit Payout Task,LetterofCreditDemandPayment,Letter of Credit,Role for Initiate Letter of Credit Payout Task service operation
Initiate Seller Obligation Confirmation Task,SellerObligationConfirmation,Letter of Credit,Role for Initiate Seller Obligation Confirmation Task service operation
Notify Customer Collateral Allocation Task,CustomerCollateralAllocation,Letter of Credit,Role for Notify Customer Collateral Allocation Task service operation
Notify Customer Payment Task,CustomerPayment,Letter of Credit,Role for Notify Customer Payment Task service operation
Notify Letter of Credit Definition and Pricing Task,LetterofCreditDefinitionandPricing,Letter of Credit,Role for Notify Letter of Credit Definition and Pricing Task service operation
Notify Letter of Credit Issuance and Booking Task,LetterofCreditIssuance,Letter of Credit,Role for Notify Letter of Credit Issuance and Booking Task service operation
Notify Letter of Credit Payout Task,LetterofCreditDemandPayment,Letter of Credit,Role for Notify Letter of Credit Payout Task service operation
Notify Seller Obligation Confirmation Task,SellerObligationConfirmation,Letter of Credit,Role for Notify Seller Obligation Confirmation Task service operation
Request Customer Collateral Allocation Task,CustomerCollateralAllocation,Letter of Credit,Role for Request Customer Collateral Allocation Task service operation
Request Customer Payment Task,CustomerPayment,Letter of Credit,Role for Request Customer Payment Task service operation
Request Letter of Credit Definition and Pricing Task,LetterofCreditDefinitionandPricing,Letter of Credit,Role for Request Letter of Credit Definition and Pricing Task service operation
Request Letter of Credit Issuance and Booking Task,LetterofCreditIssuance,Letter of Credit,Role for Request Letter of Credit Issuance and Booking Task service operation
Request Letter of Credit Payout Task,LetterofCreditDemandPayment,Letter of Credit,Role for Request Letter of Credit Payout Task service operation
Request Seller Obligation Confirmation Task,SellerObligationConfirmation,Letter of Credit,Role for Request Seller Obligation Confirmation Task service operation
Retrieve Customer Collateral Allocation Task,CustomerCollateralAllocation,Letter of Credit,Role for Retrieve Customer Collateral Allocation Task service operation
Retrieve Customer Payment Task,CustomerPayment,Letter of Credit,Role for Retrieve Customer Payment Task service operation
